[
  {
    "id": "erman-retelling",
    "type": "retelling",
    "author": "Э.Н. Темкин, В.Г. Эрман",
    "author_wikidata": "Q4532534",
    "author_viaf": "180632999",
    "title": "Рамаяна (литературное изложение)",
    "year": "1965",
    "description": "Классическое советское прозаическое изложение эпоса (М.: Наука, 1965), ориентированное на широкого читателя, — именно литературный пересказ, а не перевод с санскрита. «Сказание о Раме» тех же авторов вошло также в сборник «Три великих сказания Древней Индии» (1978, неоднократно переиздавался). Удобный первый вход в сюжет «Рамаяны» перед чтением академического перевода.",
    "status": "available"
  },
  {
    "id": "bhaktivedanta-retelling",
    "type": "adaptation",
    "author": "Кришнаитские адаптации",
    "title": "Рамаяна",
    "description": "Религиозные и популярные адаптации сюжета Рамаяны в традиции гаудия-вайшнавизма. Передают эпос сквозь призму вероучения, а не текстологии, и переводами с санскрита не являются. Конкретные издания и годы в каталоге проекта не зафиксированы. Подходят читателю, которого интересует религиозное прочтение сюжета.",
    "status": "available"
  },
  {
    "id": "narayan-retelling",
    "type": "retelling",
    "author": "Р.К. Нарайян",
    "author_wikidata": "Q334252",
    "author_viaf": "111543455",
    "title": "Рамаяна (пересказ)",
    "description": "Современный краткий прозаический пересказ индийского классика Расипурама Кришнасвами Нарайяна — авторское изложение сюжета, а не перевод текста Вальмики. Год русского издания в каталоге проекта не зафиксирован. Подходит для быстрого знакомства с фабулой эпоса глазами индийского писателя XX века.",
    "status": "available"
  }
]
